{
  "experiment_id": "exp_0023_bear_cooldown_bcd1",
  "parent_id": "channel_breakout_v2_1_balanced",
  "candidate_role": "standalone",
  "strategy": "exit_logic_variant",
  "description": "BCD-1: BEAR-only cooldown for v2.1 ChannelBreakout. After two consecutive losing BEAR-entry trades, block new BEAR entries for 3 days.",
  "hypothesis": "The 2022 BEAR drawdown cluster is caused by repeated breakout failure. A short BEAR-only cooldown after observed losses should reduce churn without permanently filtering BEAR reversal alpha.",
  "expected_behavior_change": "BEAR trading pauses briefly after consecutive realized failures. Existing positions can still exit normally, and BULL/NEUTRAL are baseline-like.",
  "base": "v2.1_balanced",
  "status": "research_only",
  "constraints": [
    "no_future_data",
    "inherits_v21_risk",
    "no_demo_routing",
    "research_only"
  ],
  "params": {
    "strategy_type": "exit_logic_channel_breakout",
    "regime_change_policy": "permission_based",
    "regime_filter": {
      "fast_days": 50,
      "slow_days": 200
    },
    "exit_logic": {
      "exit_lookback": 0,
      "take_profit_pct": 0.05,
      "stop_loss_pct": 0.1,
      "max_hold_bars": 720,
      "trailing_stop": true,
      "profit_lock": {
        "enabled": false,
        "activate_profit_pct": 0.2,
        "giveback_ratio": 0.8,
        "trailing_atr_multiplier": 0.0,
        "atr_period": 14,
        "min_hold_bars_before_lock": 0
      },
      "bear_cooldown": {
        "enabled": true,
        "loss_streak": 2,
        "cooldown_bars": 864,
        "scope": "bear_entry_trades"
      }
    },
    "bull": {
      "candidate": "U4_cons3",
      "description": "375/432 long-only; daily close below EMA50 for 3 completed days disables/closes long",
      "strategy_params": {
        "entry_lookback": 375,
        "min_hold_bars": 432,
        "enable_long": true,
        "enable_short": false
      },
      "permission": {
        "allow_long": true,
        "allow_short": false,
        "close_below_ema_disables_long": true,
        "ema_fast": 50,
        "consecutive_below_ema_days": 3
      }
    },
    "bear": {
      "candidate": "K0_base_BCD1",
      "description": "375/432 dual with BEAR cooldown after two consecutive losing BEAR-entry trades",
      "strategy_params": {
        "entry_lookback": 375,
        "min_hold_bars": 432,
        "enable_long": true,
        "enable_short": true
      },
      "permission": {
        "allow_long": true,
        "allow_short": true
      }
    },
    "neutral": {
      "candidate": "N3_dir",
      "description": "375/432 directional; long/short only when close and EMA50 slope agree",
      "strategy_params": {
        "entry_lookback": 375,
        "min_hold_bars": 432,
        "enable_long": true,
        "enable_short": true
      },
      "permission": {
        "allow_long": true,
        "allow_short": true,
        "directional_only": true,
        "ema_fast": 50,
        "ema_slope_days": 5
      }
    }
  }
}
