{
  "experiment_id": "exp_0018_profit_lock_pl2",
  "parent_id": "channel_breakout_v2_1_balanced",
  "candidate_role": "standalone",
  "strategy": "exit_logic_variant",
  "description": "PL-2 balanced profit-lock overlay for v2.1 ChannelBreakout: activate after 8% MFE, exit after 35% giveback or 3x ATR trail.",
  "hypothesis": "A profit-lock overlay can reduce large open-profit giveback without clipping early trend continuation, preserving v2.1 BEAR alpha while improving Sharpe or drawdown.",
  "expected_behavior_change": "Entries and regime permissions remain unchanged. Exits may occur earlier after profitable excursions, increasing trade count moderately and improving MFE capture.",
  "base": "v2.1_balanced",
  "status": "research_only",
  "constraints": [
    "no_future_data",
    "inherits_v21_risk",
    "no_demo_routing",
    "research_only"
  ],
  "params": {
    "strategy_type": "exit_logic_channel_breakout",
    "regime_change_policy": "permission_based",
    "regime_filter": {
      "fast_days": 50,
      "slow_days": 200
    },
    "exit_logic": {
      "exit_lookback": 0,
      "take_profit_pct": 0.05,
      "stop_loss_pct": 0.1,
      "max_hold_bars": 720,
      "trailing_stop": true,
      "profit_lock": {
        "enabled": true,
        "activate_profit_pct": 0.08,
        "giveback_ratio": 0.35,
        "trailing_atr_multiplier": 3.0,
        "atr_period": 14,
        "min_hold_bars_before_lock": 72
      }
    },
    "bull": {
      "candidate": "U4_cons3_PL2",
      "description": "375/432 long-only with PL-2 profit-lock overlay; daily close below EMA50 for 3 completed days disables/closes long",
      "strategy_params": {
        "entry_lookback": 375,
        "min_hold_bars": 432,
        "enable_long": true,
        "enable_short": false
      },
      "permission": {
        "allow_long": true,
        "allow_short": false,
        "close_below_ema_disables_long": true,
        "ema_fast": 50,
        "consecutive_below_ema_days": 3
      }
    },
    "bear": {
      "candidate": "K0_base_PL2",
      "description": "375/432 dual with PL-2 profit-lock overlay; no additional filtering",
      "strategy_params": {
        "entry_lookback": 375,
        "min_hold_bars": 432,
        "enable_long": true,
        "enable_short": true
      },
      "permission": {
        "allow_long": true,
        "allow_short": true
      }
    },
    "neutral": {
      "candidate": "N3_dir_PL2",
      "description": "375/432 directional with PL-2 profit-lock overlay; long/short only when close and EMA50 slope agree",
      "strategy_params": {
        "entry_lookback": 375,
        "min_hold_bars": 432,
        "enable_long": true,
        "enable_short": true
      },
      "permission": {
        "allow_long": true,
        "allow_short": true,
        "directional_only": true,
        "ema_fast": 50,
        "ema_slope_days": 5
      }
    }
  }
}
